<?xml version="1.0" encoding="UTF-8"?>
<mapping xmlns:xsi="http://www.w3.org/2001/XMLSchema-instance" 
		 xmlns="http://juffrou.sourceforge.net/juffrou-xml"
         xsi:schemaLocation="http://juffrou.sourceforge.net/juffrou-xml http://juffrou.sourceforge.net/juffrou-xml/schemas/juffrou-xml.xsd">

	<preferences>
		<collectionWithSizeAttribute>false</collectionWithSizeAttribute>
	</preferences>

	<serializer id="simpledate" class="net.sf.juffrou.xml.test.dom.SimpleDateSerializer"/>

	<root-element xml="Person" type="net.sf.juffrou.xml.test.dom.Person">
		<element property="firstName">
			<xml id="firstName" node="attribute" />
		</element>
		<element property="lastName" />
		<element property="birthDay">
			<serializer ref="simpledate" />
		</element>
	</root-element>
	
</mapping>